SUBJECT_ID,HADM_ID,SEQ_NUM,ICD9_CODE,SHORT_TITLE,LONG_TITLE,ICUSTAY_ID,HCUP_CCS_2015,USE_IN_BENCHMARK
40456,161765,1,42823,Ac on chr syst hrt fail,Acute on chronic systolic heart failure,242790,Congestive heart failure; nonhypertensive,1
40456,161765,2,4280,CHF NOS,"Congestive heart failure, unspecified",242790,Congestive heart failure; nonhypertensive,1
40456,161765,3,4240,Mitral valve disorder,Mitral valve disorders,242790,Heart valve disorders,0
40456,161765,4,42789,Cardiac dysrhythmias NEC,Other specified cardiac dysrhythmias,242790,Cardiac dysrhythmias,1
40456,161765,5,41401,Crnry athrscl natve vssl,Coronary atherosclerosis of native coronary artery,242790,Coronary atherosclerosis and other heart disease,1
40456,161765,6,2859,Anemia NOS,"Anemia, unspecified",242790,Deficiency and other anemia,0
40456,161765,7,V1251,Hx-ven thrombosis/embols,Personal history of venous thrombosis and embolism,242790,Phlebitis; thrombophlebitis and thromboembolism,0
40456,161765,8,V5861,Long-term use anticoagul,Long-term (current) use of anticoagulants,242790,Other aftercare,0
40456,161765,9,2811,B12 defic anemia NEC,Other vitamin B12 deficiency anemia,242790,Deficiency and other anemia,0
